<!ELEMENT tienda (producto+)>

<!ELEMENT producto (nombre, precio, imagen)>
<!ATTLIST producto id CDATA #IMPLIED>

<!ELEMENT nombre (#PCDATA)>
<!ELEMENT precio (#PCDATA)>
<!ELEMENT imagen (#PCDATA)>